{
  "id": "500123",
  "status": "PAID",
  "traceIds": {
    "AVAILITY_TRACE_ID": "a1b2c3d4e5f6a1b2c3d4e5f6a1b2c3d4",
    "PAYER_TRACE_ID": "277-trace-001"
  },
  "amounts": {
    "billed": 250.0,
    "allowed": 200.0,
    "paid": 160.0,
    "patientResponsibility": 40.0
  },
  "completeCode": "COMPLETE",
  "errors": [
    {
      "code": "ABC123",
      "message": "Sample description"
    }
  ]
}